key,0,1,2,3,4,5,6,7,8,9,10,11,12,13,14,15,16,17
#,EventType,EnemyType,,,LGBEventObject,LGBMapRange,Quest,,SingleBattle,Announce,Name,Description,,,,,,
int32,DynamicEventType,DynamicEventEnemyType,byte,byte,bit&01,uint32,Quest,uint32,DynamicEventSingleBattle,LogMessage,uint32,str,str,int16,int16,int16,uint32,uint32
0,0,0,0,0,True,0,0,0,0,0,0,"","",0,0,0,0,0
1,1,4,48,20,True,8373717,8511877,69477,0,0,0,"腐乱野菜「ピーリフール」","魔獣大隊の百人隊長クラリシーが
腐りかけた草木綱の魔物を放棄した
腐乱野菜、ピーリフールを倒せ",0,0,0,0,0
2,1,2,48,20,True,8374110,8511881,69477,0,0,0,"戦争の妖犬「カニスディルス」","術士大隊が戦列をかき乱すため
三つ首の妖犬を召喚した
戦争の妖犬、カニスディルスを倒せ",0,0,0,0,0
3,1,1,48,20,True,8367113,8511882,69477,0,0,0,"高火力陸戦魔導兵器「ヴィジル」","機械化歩兵大隊の強化兵ダボグが駆る
ガードスコーピオンの改修機が現れた
高火力陸戦魔導兵器、ヴィジルを倒せ",0,0,0,0,0
4,2,3,1,20,True,8367033,8511886,69477,0,1,0,"新型飛行型魔導アーマー「ガブリエル」","機械化歩兵大隊の強化兵ダボグが駆る
新型飛行型魔導アーマーが飛来した
一騎打ちに応じ、ガブリエルを倒せ",0,0,0,0,0
5,1,4,48,20,True,8342248,8511887,69477,0,0,0,"黒き死鳥「アクババ」","魔獣大隊の鳥使いたちが
ボズヤ・レジスタンスに損害を与えている
死鳥アクババと、鳥使いを倒せ",0,0,0,0,0
6,1,5,48,20,True,8367316,8511891,69481,0,0,0,"怨念の死霊「スパルトイ」","術士大隊の選抜兵ロフィーが
実験動物モノセロスを連れて脱走を図った
モノセロスと共に、死霊スパルトイを倒せ",0,0,0,0,0
7,1,4,48,20,True,8374867,8511892,69481,0,0,0,"赤チョコボのヌシ「レッドコメット」","南方ボズヤ戦線に
いずこからか赤チョコボの群れが現れた
群れのヌシ、レッドコメットを倒せ",0,0,0,0,0
8,2,3,1,20,True,8374963,8511893,69481,0,2,0,"百獣使い「獣王ライアン」","魔獣大隊を率いる歴戦の千人隊長
ライアンから挑戦を受けた
一騎打ちに応じ、獣王ライアンを倒せ",0,0,0,0,0
9,3,2,24,20,True,8375462,8511895,69481,0,0,0,"炎獣使い「火焔百人隊」","炎獣ピュロボロスを使役する
術士大隊火焔百人隊が進撃してきた
敵部隊をせん滅し、進攻を阻止せよ",0,0,0,0,0
10,1,1,48,20,True,8374781,8511898,69481,0,0,0,"拠点防衛魔導兵器「パトリオット」","機械化歩兵大隊が
拠点の防備を固めるため新兵器を配備した
拠点防衛魔導兵器、パトリオットを倒せ",0,0,0,0,0
11,1,2,24,20,True,8377121,8511901,69484,0,0,0,"邪眼の妖獣「エアレー」","術士大隊の妖術士が
不気味な妖獣を戦場に解き放った
邪眼の妖獣、エアレーを倒せ",0,0,0,0,0
12,2,3,1,20,True,8374538,8511905,69484,0,3,0,"老練の魔道士「鉄火のサルトヴォアール」","強敵を求めるパイロマンサーが現れた
第IV軍団術士大隊の上級百人隊長
鉄火のサルトヴォアールを一騎打ちで倒せ",0,0,0,0,0
13,1,1,48,20,True,8367337,8511910,69484,0,0,0,"鋼鉄の魔獣「ダーインスレイヴ」","機械化歩兵大隊の魔導技師長シシニアスが
新型の魔導兵器を戦場に送り込んだ
鋼鉄の魔獣、ダーインスレイヴを倒せ",0,0,0,0,0
14,1,1,48,20,True,8377886,8511912,69484,0,0,0,"新たなる鉄巨人「魔導レイバーX型」","機械化歩兵大隊の魔導技師長シシニアスが
古代兵器に改良を加え、実戦投入した
新たなる鉄巨人、魔導レイバーX型を倒せ",0,0,0,0,0
15,1,5,48,20,True,8367328,8511913,69484,0,0,0,"戦慄の角「チルヴニク」","魔獣大隊が秘薬を用いて
魔獣の死体を蘇らせ戦力化した
戦慄の角、チルヴニクを倒せ",0,0,0,0,0
16,4,6,48,20,True,0,0,69487,1,0,9626,"カストルム・ラクスリトレ攻城戦","第IV軍団のボズヤにおける本拠点
カストルム・ラクスリトレに攻め上った
障害を突破し、砦を制圧せよ",0,0,0,0,0
17,3,2,48,20,True,8664684,8664761,69620,0,0,0,"妖霊使い「妖戦百人隊」","妖霊ジルニトラを使役する
術士大隊妖戦百人隊が進撃してきた
敵部隊をせん滅し、進攻を阻止せよ",0,0,0,0,0
18,1,1,48,20,True,8664685,8664762,69629,0,0,0,"試作飛行型魔導アーマー「ブラックバーン」","ヘルダイバーの改良機と思しき
試作飛行型魔導アーマーが飛来した
ブラックバーンを倒せ",0,0,0,0,0
19,2,3,1,20,True,8664686,8664763,69620,0,4,0,"非業の強化兵「ハイパーチューンド・ダボグ」","機械化歩兵大隊の強化兵ダボグが
おぞましき生体兵器に改造された
ハイパーチューンド・ダボグを倒せ",0,0,0,0,0
20,1,8,48,20,True,8664687,8664764,69620,0,0,0,"模造密告者「IVレギオン・シュミハザ」","魔導僧兵大隊の異端僧兵が
命を賭して聖石片の力を解放した
IVレギオン・シュミハザを倒せ",0,0,0,0,0
21,1,4,48,20,True,8664688,8664765,69620,0,0,0,"焦土の魔蠍「ヘデテト」","魔獣大隊のビーストマスターが
ザ・バーンで捕獲した魔蠍を解き放った
焦土の魔蠍、ヘデテトを倒せ",0,0,0,0,0
22,3,7,48,20,True,8664689,8664766,69628,0,0,0,"鋼鉄の人馬「魔導騎兵大隊」","第IV軍団が増援部隊として
無人型魔導兵器を投入した
魔導騎兵大隊を一掃せよ",0,0,0,0,0
23,2,3,1,20,True,8664690,8664767,69628,0,5,0,"第IV軍団分遣隊長「メネニウス」","ボズヤ駐留軍を指揮する分遣隊長
メネニウスから挑戦を受けた
一騎打ちに応じ、メネニウスを倒せ",0,0,0,0,0
24,1,2,48,20,True,8664691,8664768,69628,0,0,0,"異界の廃王「ハンビ」","術士大隊の妖術士が
血を求める大妖異を召喚した
異界の廃王、ハンビを倒せ",0,0,0,0,0
25,1,2,48,20,True,8664692,8664769,69628,0,0,0,"邪悪なる氷狼「フローズヴィトニル」","術士大隊の妖術士が
魔力を練り上げ使い魔を召喚した
邪悪なる氷狼、フローズヴィトニルを倒せ",0,0,0,0,0
26,1,8,48,20,True,8664693,8664770,69628,0,0,0,"模造魔人「IVレギオン・ベリアス」","魔導僧兵大隊の異端僧兵が
命を賭して聖石片の力を解放した
IVレギオン・ベリアスを倒せ",0,0,0,0,0
27,3,1,48,20,True,8664694,8664771,69629,0,0,0,"新兵器投入「機甲百人隊」","機械化歩兵大隊の魔導技師長シシニアスが
新型を含む魔導兵器群を戦場に送り込んだ
機甲百人隊をせん滅せよ",0,0,0,0,0
28,1,4,48,20,True,8664695,8664772,69629,0,0,0,"有角の凶鳥「アルコノスト」","魔獣大隊の鳥使いが
戦線を押し上げるべく切り札を投入した
有角の凶鳥、アルコノストを倒せ",0,0,0,0,0
29,1,8,48,20,True,8664696,8664773,69620,0,0,0,"模造統制者「IVレギオン・ハシュマリム」","魔導僧兵大隊の異端僧兵が
命を賭して聖石片の力を解放した
IVレギオン・ハシュマリムを倒せ",0,0,0,0,0
30,1,2,48,20,True,8664697,8664774,69629,0,0,0,"輝ける虹蛇「アイダ」","術士大隊が戦線を支えるべく
新たな魔法生物を召喚した
輝ける虹蛇、アイダを倒せ",0,0,0,0,0
31,2,3,1,20,True,8664698,8664775,69629,0,6,0,"戦慄の百獣使い「獣王ライアン」","猛者を探し求める千人隊長
ライアンから挑戦を受けた
一騎打ちに応じ、獣王ライアンを倒せ",0,0,0,0,0
32,4,6,48,20,True,0,0,69624,5,0,9678,"旗艦ダル･リアータ攻略戦","敵旗艦は行動不能に陥った
今こそ仲間たちと共に乗り込み
その最奥に潜む敵を討て",222,302,-661,0,0
33,1,4,72,20,True,10962704,0,0,0,0,0,"脳髄愛好家「マインドフレイア」","新鮮な脳を好む妖異が
獲物を求め襲い掛かってきた
脳髄愛好家、マインドフレイアを倒せ",0,0,0,0,0
34,3,4,72,20,True,10940977,0,0,0,0,0,"黒の連隊","三日月島の黒チョコボたちが
群れをなして襲いかかってきた
黒チョコボたちをせん滅せよ",0,0,0,0,0
35,1,4,72,20,True,10962716,0,0,0,0,0,"怒れる人造人間「クレセント・バーサーカー」","創造主に特定の感情を吹き込まれた
人型使い魔が暴れている
怒れる人造人間、クレセント・バーサーカーを倒せ",0,0,0,0,0
36,1,4,72,20,True,10940989,0,0,0,0,0,"忍び寄る爪「デスクロー」","禁術によって生成された死霊が
生者を求め彷徨っている
忍び寄る爪、デスクローを倒せ",0,0,0,0,0
37,1,4,72,20,True,10941018,0,0,0,0,0,"封印大妖「クロイスターデーモン」","島の主に封じられた大妖異が
戒めを解かんと異空間から現れた
封印大妖、クロイスターデーモンを倒せ",0,0,0,0,0
38,1,4,72,20,True,10962728,0,0,0,0,0,"模造されしもの「水晶竜」","島の主に造られた使い魔が
侵入者の力を測るべく姿を現した
模造されしもの、水晶竜を倒せ",0,0,0,0,0
39,1,4,72,20,True,10937430,0,0,0,0,0,"神秘の偶像「ミシカルアイドル」","禍々しさと神々しさが同居する
謎めいた土偶が現れた
神秘の偶像、ミシカルアイドルを倒せ",0,0,0,0,0
40,3,4,72,20,True,11131960,0,0,0,0,0,"石造りの守護騎士たち","建造物を守るため
騎士像が戦いを挑んできた
クレセントナイトたちを倒せ",0,0,0,0,0
41,1,4,72,20,True,11102245,0,0,0,0,0,"伝説の鮫「ニーム・ペタロドゥス」","海洋都市ニームの伝説に謳われる
凶暴な鮫人が現れた
伝説の鮫、ニーム・ペタロドゥスを倒せ",0,0,0,0,0
42,1,4,72,20,True,10937461,0,0,0,0,0,"二足の獅子「ランパントライオン」","白魔法を込められた石像が
石造りの城塞に現れた
二足の獅子、ランパントライオンを倒せ",0,0,0,0,0
43,1,4,72,20,True,11102367,0,0,0,0,0,"セキュリティ・コマンドー","治安維持用の石人形が
冒険者を危険因子と判断した
コマンドポットたちを倒せ",0,0,0,0,0
44,1,4,72,20,True,10941033,0,0,0,0,0,"鳥嫌いの巨獣「ネオガルラ」","やかましい鳥に縄張りを荒らされ
怒り狂う獣が現れた
鳥嫌いの巨獣、ネオガルラを倒せ",0,0,0,0,0
45,1,4,72,20,True,10962741,0,0,0,0,0,"呪いの商亀「コイントートス」","魔法で知恵を与えられた陸亀が
呪物を売りつけようと企んでいる
呪いの商亀、コイントートスを倒せ",0,0,0,0,0
46,1,4,72,20,True,10937473,0,0,0,0,0,"復元された獅子像「リペアドライオン」","魔大戦期に用いられた防衛機構が
侵入者の前に立ちふさがる
復元された獅子像、リペアドライオンを倒せ",0,0,0,0,0
47,1,4,72,20,True,10962753,0,0,0,0,0,"昏き篝火「ヒンキーパンク」","鳥を模した古い彫像に
妖異の魂が憑依して動き出した
昏き篝火、ヒンキーパンクを倒せ",0,0,0,0,0
48,4,6,48,30,False,0,0,70853,0,0,0,"フォークタワー：力の塔","三日月島南部に
蜃気楼のような謎の塔が現れた
仲間と共に突入し、最上層を踏破せよ",0,0,0,63978,63978
